Cliente_ID,Inquérito_ID,Pontuação,Comentário,Data do Inquérito
906,723,3,Repudiandae facere culpa numquam.,2023-09-01 01:28:06
675,724,3,Officiis nostrum occaecati possimus impedit minus eaque.,2015-05-08 09:32:24
415,725,5,Voluptatibus veritatis molestias natus reprehenderit iusto veniam.,2017-11-25 22:45:33
6,726,5,Voluptas esse quod harum dolor.,2016-01-15 12:32:27
600,727,1,Exercitationem sint alias quos.,2016-09-13 18:26:21
313,728,1,Laudantium iste recusandae ut vel nostrum.,2023-04-28 13:13:24
30,729,4,Vel quam debitis eligendi deserunt.,2023-06-22 11:00:07
581,730,4,Explicabo consequuntur repellendus aspernatur.,2017-05-19 22:47:03
937,731,4,Voluptatibus occaecati ipsum eaque nihil.,2022-11-01 05:13:31
533,732,1,Alias temporibus facere ducimus qui.,2024-06-16 19:21:38
536,733,5,Itaque id dolore ex ducimus minus a debitis.,2020-02-18 08:05:18
770,734,5,Minima assumenda quas similique necessitatibus soluta reiciendis.,2024-12-22 17:50:01
162,735,2,Neque blanditiis illo nemo distinctio rem.,2019-02-06 10:30:08
712,736,4,Perferendis laboriosam ab aut voluptate qui ducimus.,2021-12-05 17:15:29
477,737,1,Ratione doloribus facere commodi eaque harum sit.,2017-10-20 13:12:04
66,738,4,Itaque provident sed error inventore quia.,2014-08-13 11:59:22
13,739,2,Ipsum incidunt consequatur labore ipsam aperiam ex quas.,2024-06-15 20:26:51
716,740,1,Reiciendis nisi sed adipisci laudantium nostrum.,2018-07-03 22:20:59
127,741,1,Placeat officia incidunt temporibus numquam.,2019-04-23 08:14:01
453,742,1,Amet neque quam.,2015-09-01 14:45:11
600,743,2,Minus distinctio sapiente suscipit.,2015-07-02 06:46:58
652,744,2,Nobis et numquam beatae quis cupiditate.,2015-07-03 18:14:11
387,745,4,Unde maiores ut odio omnis quisquam.,2024-11-05 10:55:19
351,746,3,Quisquam architecto aperiam.,2020-02-22 16:12:54
345,747,2,Eos iusto sequi tempore itaque.,2020-01-11 23:51:33
829,748,2,Amet necessitatibus facere repudiandae.,2015-08-25 04:54:39
326,749,2,Quibusdam consectetur perferendis earum quae soluta.,2018-07-15 21:33:12
820,750,5,Beatae in ipsa.,2016-03-05 14:08:17
537,751,4,Tenetur pariatur saepe sed distinctio quae architecto.,2017-10-23 18:50:36
476,752,1,Quia aspernatur ad sit accusamus eaque dolorum quod.,2023-12-13 20:27:38
296,753,2,Deleniti occaecati similique iusto.,2024-04-08 06:15:28
749,754,3,Sequi commodi assumenda aliquam eveniet dignissimos.,2020-09-30 22:33:11
325,755,3,Illo modi totam accusamus quasi.,2019-08-03 02:11:20
970,756,1,Ullam excepturi ipsam qui eius velit qui voluptatem.,2018-03-28 16:52:39
323,757,4,Molestiae voluptatem quae necessitatibus esse.,2017-08-24 17:23:44
874,758,2,Praesentium consectetur corrupti molestias dolorum neque.,2015-01-09 16:38:12
892,759,3,Et enim quasi est delectus optio.,2014-07-05 10:23:06
414,760,3,Optio minima nesciunt debitis blanditiis voluptatem incidunt.,2015-01-30 09:09:30
445,761,4,Placeat ullam omnis saepe dolores.,2022-08-12 23:14:16
316,762,2,Id dolor omnis possimus.,2019-02-16 06:08:37
943,763,1,Dolorum optio vitae nesciunt quas voluptatibus aperiam.,2020-09-12 05:21:44
876,764,3,Eius inventore mollitia.,2015-11-21 23:02:33
604,765,3,Excepturi labore voluptates.,2024-04-20 12:55:48
206,766,1,Optio molestiae expedita nulla.,2019-11-15 16:21:27
109,767,3,Maiores vel molestiae.,2023-11-14 07:46:41
882,768,3,Facere blanditiis numquam qui cumque voluptatum.,2018-12-06 15:37:52
269,769,5,Ullam facere provident tempora.,2022-10-09 08:24:44
200,770,5,Occaecati quibusdam optio debitis.,2022-01-19 01:09:32
255,771,1,Magni enim magni.,2024-04-09 07:24:43
762,772,4,Cum earum quia odio quas.,2018-06-05 02:53:19
56,773,2,Quia asperiores officiis quisquam.,2019-02-19 03:03:12
82,774,4,Dignissimos neque debitis laboriosam.,2023-07-20 20:19:56
479,775,2,Ex veritatis iste magnam et molestiae mollitia nobis.,2016-06-01 11:28:31
447,776,3,Consectetur eligendi mollitia autem cumque.,2015-07-01 14:33:30
84,777,5,Quae asperiores blanditiis non dicta cumque.,2017-09-27 22:53:01
337,778,3,Ipsam inventore itaque facere.,2022-06-28 00:44:21
673,779,2,Ullam necessitatibus libero.,2014-01-13 09:23:44
241,780,3,Laborum magnam tempora eveniet tempora aliquid sunt.,2015-05-29 03:51:15
911,781,4,Totam optio excepturi consequatur molestiae architecto aliquam.,2017-03-30 15:53:01
165,782,3,Officiis veniam dolorem eligendi aliquam ipsa.,2014-04-08 14:10:48
801,783,5,Deleniti natus sapiente quam pariatur repellendus provident.,2023-12-23 12:46:52
312,784,1,Dolorum id velit porro.,2021-10-20 17:01:46
203,785,5,Quo molestiae corrupti in iste.,2021-09-05 07:42:10
45,786,2,Ut voluptatum dignissimos tempora sequi praesentium exercitationem deleniti.,2015-10-15 06:08:07
939,787,3,Quod eum quisquam inventore doloribus animi.,2020-05-04 23:59:05
60,788,3,Amet cum cumque cumque minus.,2014-01-27 13:09:59
539,789,4,Magni quis unde doloremque neque aliquid eaque.,2021-01-22 23:36:29
405,790,3,Quam fugit aspernatur facere repudiandae praesentium ab quasi.,2015-05-18 08:04:59
18,791,4,Sunt dicta illo sapiente recusandae sunt.,2020-01-03 09:35:09
868,792,2,Ullam illum blanditiis nobis harum possimus.,2023-05-05 13:01:21
722,793,5,Fugit nesciunt minima labore.,2023-02-15 15:02:25
117,794,1,Ipsa in deleniti maiores distinctio.,2020-01-04 18:41:24
809,795,4,Amet corrupti doloremque fugiat nesciunt dignissimos.,2016-12-03 18:11:26
793,796,1,Iure blanditiis ipsum commodi unde temporibus animi.,2020-06-30 11:26:58
611,797,5,Quae quidem repudiandae hic ipsa.,2017-03-11 09:37:46
389,798,5,Dolorem provident placeat dicta fuga corrupti soluta.,2022-07-22 17:10:35
172,799,2,Deserunt unde illum veniam.,2024-01-22 18:18:54
912,800,2,Unde atque quidem consequuntur.,2021-02-24 00:48:10
563,801,1,Officiis voluptates cum sit.,2024-03-23 15:05:14
895,802,5,Doloribus illo officiis nemo.,2020-05-14 22:55:03
333,803,1,Omnis corrupti ipsa voluptatum natus.,2018-11-18 15:55:18
235,804,3,Ut tempore minus ipsum temporibus eligendi dolorem.,2017-06-17 15:32:57
727,805,3,Et ab dignissimos explicabo.,2016-08-22 23:57:43
650,806,1,Sapiente aut tempora eos fuga esse.,2019-10-18 03:18:05
537,807,5,Cumque odio consequuntur magni voluptatibus aliquid quibusdam.,2024-01-23 02:06:10
651,808,3,Rem nobis vitae odit.,2022-07-11 14:16:30
620,809,2,Vel illo at dignissimos optio tenetur officia.,2019-10-16 15:04:26
581,810,2,Explicabo adipisci ipsa accusamus repudiandae dolorum.,2021-02-23 19:41:40
147,811,4,Quas atque totam fugiat harum corrupti.,2021-11-27 22:23:38
48,812,5,Laudantium temporibus natus sapiente itaque.,2016-10-05 02:21:33
179,813,3,Ea labore facilis dolorum.,2023-07-13 00:57:23
417,814,1,Distinctio laudantium ullam voluptate.,2023-04-28 05:00:47
207,815,4,Saepe minus quae modi.,2017-10-19 12:14:27
466,816,2,Occaecati occaecati dignissimos iste labore odio.,2022-01-28 17:50:26
347,817,5,Alias a sint.,2020-05-05 03:24:22
39,818,2,Iusto non sapiente eveniet repellendus alias quas.,2019-07-26 01:40:24
208,819,3,Veniam sed nobis quod.,2024-02-10 13:06:43
254,820,2,Occaecati amet voluptatum necessitatibus.,2024-03-16 07:27:08
318,821,3,Repudiandae nihil deserunt beatae consectetur nisi eveniet facilis.,2019-05-03 23:57:44
47,822,3,Porro ipsa omnis possimus.,2022-06-10 15:07:06
507,823,5,Suscipit deserunt dignissimos earum facilis assumenda eos.,2021-02-24 19:33:43
965,824,4,Alias facere consectetur possimus at.,2018-01-13 09:54:57
562,825,1,Consequuntur eum facere perspiciatis molestiae sed beatae laudantium.,2018-07-28 18:20:02
201,826,1,Alias consectetur id nam.,2016-04-28 12:11:23
581,827,2,Ducimus sit officia laborum dolores earum placeat.,2018-04-23 03:16:27
760,828,3,Deleniti doloremque quos cum.,2018-05-26 06:40:16
154,829,1,Sunt in eaque laborum neque eligendi.,2015-02-13 14:18:28
613,830,1,Voluptas vero perferendis numquam iusto.,2020-02-22 11:43:22
485,831,4,Totam recusandae excepturi repellendus quas accusantium.,2017-12-07 20:56:45
704,832,2,Nesciunt fugiat pariatur aut similique.,2024-06-28 00:57:09
80,833,2,Quas deserunt laborum quos ad.,2021-02-11 13:26:05
419,834,4,At nesciunt animi id eveniet.,2018-11-06 10:48:18
577,835,3,Dolorem quam explicabo odio.,2020-02-25 12:20:15
966,836,1,Eligendi molestiae cupiditate maiores alias quasi.,2018-11-26 01:31:41
701,837,1,Consectetur labore autem ab ducimus.,2023-11-02 11:16:31
435,838,2,Placeat tenetur neque id sapiente molestiae ipsam nemo.,2019-06-08 01:16:43
93,839,5,Laborum omnis cumque labore.,2019-06-17 02:17:06
239,840,1,Ipsa nemo dolorum at ducimus ea molestias nesciunt.,2019-10-12 23:37:33
938,841,4,Asperiores alias cumque ut totam.,2023-08-30 18:03:00
350,842,1,Exercitationem accusantium libero voluptate laborum aliquid perferendis.,2015-04-06 20:09:08
705,843,3,Nisi harum minima exercitationem.,2017-10-18 00:49:56
998,844,1,Unde vel numquam ratione dolorem.,2015-04-08 03:05:01
159,845,1,Nemo corporis nam perferendis.,2019-12-06 09:44:20
216,846,1,Eligendi dicta quibusdam doloremque itaque non.,2014-11-13 12:01:07
388,847,2,Occaecati quam deleniti dolores dolorem dolorem.,2016-11-18 06:06:02
262,848,3,Corporis eum vero earum cupiditate.,2022-12-14 04:01:16
337,849,1,Nam eius soluta autem incidunt adipisci.,2020-06-09 08:16:00
982,850,1,Quisquam laborum numquam expedita aspernatur voluptas adipisci.,2015-05-17 15:40:53
42,851,3,Optio possimus fuga eius.,2017-09-29 07:00:54
301,852,2,Earum deleniti velit iste nam ratione non.,2023-10-27 23:31:11
270,853,2,Ratione atque nihil.,2015-01-16 21:58:00
491,854,2,Unde dignissimos ut autem.,2022-05-02 02:29:36
274,855,1,Alias ipsum in nobis.,2020-06-18 14:12:25
857,856,4,Ratione consequatur vero laborum.,2023-02-09 06:38:32
413,857,3,Veritatis in cum eos esse consequuntur neque delectus.,2017-12-13 21:34:04
311,858,4,Quo ad nihil mollitia dolores totam.,2022-10-18 16:37:20
870,859,5,Earum sint velit culpa.,2016-05-10 08:19:26
409,860,3,Minima maxime quo ipsam.,2018-12-14 05:00:16
240,861,5,Ea error magnam quam tempora sequi possimus.,2018-05-09 03:43:03
138,862,3,Minima in omnis earum dignissimos voluptatem saepe.,2023-11-09 21:49:57
1,863,4,Quasi aperiam iste ex doloribus.,2020-10-24 13:03:19
511,864,5,Accusantium reprehenderit iusto iusto rerum aut fugiat omnis.,2023-12-12 01:10:16
490,865,2,Repellat placeat maiores ratione pariatur.,2017-04-09 14:02:33
30,866,5,Omnis repudiandae similique nostrum dolore quis.,2022-11-24 16:35:10
652,867,2,Reprehenderit illo iste libero ipsum alias.,2024-08-04 18:18:59
628,868,3,Ad optio temporibus voluptatibus.,2017-06-26 09:04:01
209,869,5,Placeat modi quo modi sed.,2014-08-02 16:55:26
434,870,1,Natus aliquam atque.,2024-10-11 13:32:29
473,871,1,Accusantium consectetur minus natus nisi illo.,2015-01-03 08:45:17
137,872,1,Neque tenetur cumque.,2014-01-11 08:58:27
550,873,1,Eos rem ratione aspernatur doloribus eveniet animi.,2014-12-24 12:49:05
575,874,2,Nulla molestias labore.,2024-05-13 16:52:58
203,875,3,Consequuntur deserunt officia quae nulla id ipsam.,2022-10-05 03:10:58
78,876,5,Laborum veniam error cupiditate error labore laborum.,2021-06-16 04:21:33
590,877,3,Quos ea fuga sunt dolorum dolorem voluptatum.,2021-08-07 19:53:28
661,878,4,Nihil nobis quasi sit eveniet ipsam.,2015-06-25 22:19:30
809,879,3,Quaerat delectus facilis rem nisi distinctio vitae.,2021-12-04 19:34:15
378,880,4,Excepturi voluptatem minima.,2020-04-01 15:03:38
988,881,5,Nulla assumenda incidunt autem corporis.,2020-05-20 16:09:41
726,882,1,Dolorem quo rerum corrupti.,2015-05-11 07:55:14
570,883,5,Illum incidunt architecto dicta impedit neque.,2021-02-06 15:18:25
323,884,5,Explicabo consequatur voluptate consectetur sed dolor.,2018-09-09 23:46:33
33,885,1,Inventore nisi temporibus dignissimos.,2023-01-06 04:46:59
221,886,1,Consequatur voluptas dolore.,2014-01-31 03:55:36
361,887,1,Illum cum ducimus commodi quis exercitationem illo.,2014-06-01 04:12:51
460,888,3,Laborum cumque debitis ipsum ducimus.,2024-06-15 23:51:06
804,889,1,Culpa fuga voluptatem quos.,2016-07-07 19:46:25
102,890,4,Repudiandae quod mollitia eum delectus unde.,2014-01-01 00:46:20
880,891,2,Rem culpa eius doloribus.,2015-05-19 15:34:40
853,892,3,Eum vel sapiente.,2022-08-04 13:27:33
573,893,5,Rerum culpa iure voluptatibus totam nobis labore fugit.,2024-02-28 03:21:54
479,894,2,Rem esse officiis consectetur itaque aliquid sapiente architecto.,2019-08-11 16:02:49
630,895,5,Aperiam ipsa sequi maxime laboriosam officiis sit et.,2022-09-19 03:17:32
222,896,4,Sapiente aperiam nihil nemo culpa reiciendis.,2021-03-21 03:15:00
886,897,2,Quia in sapiente magnam temporibus exercitationem fuga.,2015-12-10 07:04:23
883,898,4,Quae exercitationem quidem iste eius alias.,2021-10-20 05:10:40
78,899,4,Numquam dolores fugit doloremque assumenda.,2017-04-20 06:00:03
219,900,4,Ratione fugiat sapiente provident ipsam.,2020-09-16 19:58:18
386,901,3,Neque iure dolorum possimus iusto ullam quidem.,2017-12-03 18:20:10
213,902,5,Blanditiis saepe quod nulla ratione laborum.,2018-09-03 08:12:58
697,903,1,Itaque vero iure occaecati veritatis.,2019-01-30 10:01:46
367,904,2,Ipsum distinctio quia.,2016-04-28 06:27:18
999,905,4,Quae in sequi facilis ea.,2020-11-12 02:34:12
565,906,4,Fuga consectetur sit odio.,2021-09-15 13:22:52
217,907,3,Dolores et itaque ipsam maxime dolorum.,2014-07-30 07:08:28
974,908,1,Id consequuntur quos esse veniam saepe perferendis.,2016-11-30 14:44:41
310,909,3,Itaque impedit repellendus perferendis.,2021-10-05 23:42:54
689,910,4,Inventore ipsa sint assumenda consequuntur.,2017-08-27 01:00:56
490,911,5,Necessitatibus eveniet saepe tenetur.,2018-03-22 19:08:55
107,912,1,At esse quaerat ut quos aliquam cum tempore.,2022-07-04 20:44:34
419,913,3,Doloribus nostrum maxime maxime facilis.,2019-03-22 14:58:53
245,914,2,Minus nobis voluptates aut ducimus.,2019-06-04 10:35:49
505,915,3,Dolorem odit voluptates quis id ex ex omnis.,2021-12-15 12:59:55
88,916,5,Qui dolorum quo molestiae.,2022-08-11 10:04:06
751,917,1,Voluptas beatae culpa optio.,2022-09-20 17:14:50
985,918,1,Possimus commodi modi voluptatum tempore est.,2019-03-15 10:50:58
943,919,4,Hic vitae ratione sint.,2022-01-27 01:40:51
139,920,3,Incidunt voluptates numquam mollitia sit.,2018-09-29 21:59:35
680,921,1,Sapiente dolores totam cumque earum aliquam amet in.,2021-06-15 15:58:46
108,922,2,Iure ratione aut in tempore corporis.,2015-03-02 15:49:05
222,923,2,Aut consequatur laboriosam fugit qui voluptate.,2021-10-01 10:25:48
341,924,5,Ducimus dolorem veritatis voluptate dolores repudiandae non.,2019-08-27 17:13:03
930,925,4,Officia eaque necessitatibus iusto ducimus.,2016-04-25 10:06:13
607,926,2,Perspiciatis deserunt veritatis numquam in laboriosam commodi.,2016-09-26 19:51:52
317,927,4,Voluptatum officia hic quam sed explicabo voluptas.,2020-05-23 22:21:21
824,928,4,Excepturi similique architecto ea ducimus sint.,2021-02-11 06:45:18
407,929,2,Maiores nisi optio similique magnam dolor.,2021-10-28 06:19:11
430,930,2,Rerum eius error error praesentium.,2024-02-04 21:44:22
673,931,1,Mollitia sunt dolores tenetur dolor minima consectetur.,2014-08-01 23:31:37
102,932,2,Maiores quis doloribus cupiditate iste eaque rerum.,2024-01-01 13:38:27
467,933,2,Quis provident modi molestias quae.,2018-02-09 23:37:38
520,934,1,Distinctio fuga illum laborum exercitationem suscipit tenetur.,2022-10-06 09:41:09
870,935,2,Ipsum cumque modi facilis.,2019-10-01 14:29:34
481,936,5,Quae minus magni fugit aliquid.,2020-09-16 11:43:09
531,937,2,Tenetur dicta odit molestiae explicabo molestiae quam veniam.,2024-07-15 03:03:17
466,938,2,Optio culpa omnis dicta.,2022-01-07 17:20:41
596,939,5,Ratione perferendis repudiandae odio laboriosam.,2022-12-21 11:56:23
139,940,3,Assumenda excepturi eum numquam quae ab modi reiciendis.,2019-03-20 15:40:01
996,941,5,Tempore odio consequuntur porro vel alias dolorem ratione.,2017-06-24 08:18:21
218,942,5,Accusamus inventore assumenda tempora minima.,2022-05-19 16:46:15
783,943,4,Occaecati harum sit voluptate sed culpa.,2020-11-19 01:24:50
356,944,4,Debitis quos quibusdam placeat tempore.,2014-11-23 14:28:07
62,945,4,Alias et neque accusantium quae.,2017-07-01 08:13:27
180,946,2,Cumque officiis incidunt porro distinctio vitae perferendis illum.,2022-12-20 02:00:20
908,947,1,Illum fuga voluptate explicabo molestiae.,2024-08-18 17:19:54
450,948,5,Aliquid quam atque minus consectetur neque libero.,2018-01-22 17:18:47
307,949,3,Quae quod dolore earum vitae officiis recusandae.,2019-11-22 19:22:43
638,950,4,Explicabo aut doloremque neque neque deleniti.,2016-04-28 21:50:03
888,951,1,Autem placeat itaque perspiciatis aspernatur dolore velit suscipit.,2019-04-01 05:54:45
15,952,5,Beatae cumque error aspernatur.,2015-03-29 00:48:05
801,953,1,Omnis molestias aliquid molestiae exercitationem.,2016-02-27 17:42:29
452,954,4,Ratione iure explicabo quaerat.,2018-11-11 07:08:27
893,955,3,Corporis ex ex.,2022-01-30 10:47:18
283,956,2,Quae quas placeat eum quas saepe reprehenderit.,2021-02-21 09:22:55
162,957,4,Enim porro quos exercitationem.,2021-10-31 15:56:47
846,958,2,Quae est iusto doloribus cum.,2021-08-02 09:45:35
258,959,1,Deleniti a autem fugit provident.,2020-02-24 19:03:19
608,960,4,Porro totam exercitationem.,2016-04-29 06:16:44
615,961,2,Quidem temporibus vero animi.,2023-02-10 18:33:11
707,962,2,Sunt id molestiae consequuntur in nostrum reiciendis.,2015-12-20 02:22:52
34,963,5,Veniam odit cumque voluptates distinctio.,2015-06-08 03:41:33
315,964,4,Id numquam minus eveniet repudiandae unde pariatur quas.,2021-01-22 01:13:43
278,965,1,Non error ipsa excepturi reprehenderit recusandae dolor earum.,2017-10-22 03:48:41
444,966,1,Blanditiis deleniti quae laudantium natus natus.,2020-03-23 17:53:10
556,967,2,Nisi ipsam facere earum.,2021-08-12 08:33:35
632,968,2,Autem doloremque porro aliquam.,2021-01-13 14:36:57
877,969,2,Molestias ut eaque.,2016-10-12 05:33:36
886,970,2,Sapiente corrupti quisquam quae neque.,2021-12-16 00:41:46
471,971,1,Temporibus quas quas explicabo quaerat autem.,2014-07-14 03:24:47
104,972,5,Deserunt occaecati possimus reprehenderit.,2023-11-20 10:12:49
92,973,3,Nihil incidunt dolor et corporis.,2020-03-10 10:29:15
961,974,5,Dolores laboriosam eius nam quas.,2015-12-10 08:24:46
404,975,4,Officiis possimus accusantium ea porro modi vitae mollitia.,2020-05-03 13:34:02
758,976,5,Quod perspiciatis quisquam.,2021-06-19 12:37:51
194,977,4,Unde excepturi voluptatum corrupti.,2023-09-07 09:51:40
255,978,4,Sit ex et perspiciatis incidunt accusamus.,2014-05-14 13:38:48
69,979,4,Illum optio optio illum molestias earum delectus ex.,2015-09-18 11:52:01
371,980,1,Incidunt voluptatum non voluptates sint.,2019-09-09 13:23:44
203,981,3,Molestias voluptatum nulla culpa illum recusandae voluptates.,2018-11-08 03:41:43
208,982,3,Accusantium quisquam consequatur quam eius.,2015-11-05 21:18:10
578,983,2,Accusantium architecto quis molestias earum voluptas eaque.,2020-01-23 03:27:05
520,984,1,Molestiae id reprehenderit temporibus omnis.,2017-03-18 00:47:48
617,985,4,Distinctio maxime quisquam laboriosam earum est reprehenderit.,2015-12-16 09:37:23
995,986,2,Laboriosam laborum ipsam.,2020-10-25 03:26:23
705,987,4,Dolor quaerat dolorem cupiditate.,2019-02-10 21:01:05
823,988,3,Nesciunt eaque voluptas aliquam.,2023-07-23 06:23:12
948,989,2,Excepturi doloremque voluptate nesciunt omnis optio quo.,2024-04-14 19:05:32
310,990,2,Quibusdam perferendis sunt.,2020-05-30 12:32:08
97,991,1,Dolor nemo neque.,2015-10-26 03:29:05
735,992,5,Ducimus distinctio eaque incidunt laudantium eos illo.,2021-01-07 12:54:46
774,993,5,Soluta mollitia nostrum cupiditate.,2016-10-18 03:03:19
782,994,5,Tenetur expedita in aperiam magni.,2019-09-12 09:18:53
740,995,4,Esse optio nulla.,2015-05-13 12:49:50
959,996,2,Doloribus necessitatibus porro nihil.,2021-05-03 12:10:46
226,997,4,Rem in maxime esse vitae harum illo.,2015-10-01 05:07:14
249,998,2,Excepturi vero animi cumque hic amet.,2017-07-15 21:38:32
437,999,1,Quidem esse quod illum fuga.,2020-04-15 11:23:32
312,1000,4,Sequi blanditiis vel alias.,2019-08-25 16:38:15
