Cliente_ID,Inquérito_ID,Pontuação,Comentário,Data do Inquérito
581,363,1,Eos eaque earum.,2019-11-17 19:41:30
622,364,2,Deleniti nesciunt beatae perferendis beatae eaque delectus optio.,2022-06-11 19:58:06
741,365,5,Facilis dolorum beatae corrupti sed sit.,2022-12-06 04:41:13
472,366,3,Repellendus quis sed aspernatur.,2021-10-01 01:57:50
627,367,3,Eveniet quo atque doloribus.,2024-02-21 13:27:50
270,368,3,Accusamus eveniet facilis officiis debitis quae.,2020-05-28 21:10:05
134,369,1,Error voluptatem soluta repellat distinctio beatae occaecati alias.,2024-09-06 07:44:57
374,370,4,Accusantium eaque esse excepturi.,2020-07-17 23:55:43
168,371,3,Beatae voluptatibus sequi dolore deleniti sapiente dolores.,2022-05-30 14:49:21
502,372,3,Vitae dolor eaque totam pariatur quo aliquam officia.,2024-12-12 06:05:00
240,373,3,Non enim illum voluptatibus quibusdam.,2017-01-08 14:06:29
292,374,2,Animi itaque voluptate itaque quasi molestiae.,2019-01-18 10:39:08
302,375,4,Enim inventore ad dolores dolor sequi ullam voluptates.,2019-02-17 12:33:16
818,376,4,Unde dolor tempora quidem quos accusantium delectus.,2015-09-27 11:12:45
967,377,2,Pariatur aperiam dignissimos odio nesciunt.,2015-12-08 04:21:17
634,378,1,Non ab quod rerum dolor vel.,2023-03-19 23:49:04
806,379,2,Corporis asperiores delectus laudantium omnis veritatis recusandae nisi.,2022-06-10 17:15:48
424,380,3,Fugiat distinctio quas suscipit reiciendis.,2020-01-22 17:07:25
468,381,2,Rem iure alias recusandae doloribus dolorem totam.,2023-01-18 02:58:15
88,382,4,Ad optio saepe rerum.,2020-11-17 23:27:46
740,383,3,Cum accusantium necessitatibus quam sed.,2021-05-23 21:45:58
456,384,1,Temporibus eaque quisquam minima optio earum.,2023-07-08 14:16:18
120,385,4,Dicta vitae magnam ut.,2015-05-27 13:37:03
950,386,4,Libero laudantium ipsam nulla.,2018-12-16 10:50:55
961,387,3,Optio magnam necessitatibus rem.,2018-04-01 07:32:40
894,388,2,Quas ipsam dicta provident assumenda.,2022-10-06 04:12:33
806,389,3,Quo dolorum saepe quibusdam sapiente eius.,2019-09-25 20:39:25
762,390,3,Dolorum debitis molestiae doloremque veniam nam.,2024-05-16 09:00:57
186,391,5,Excepturi consequuntur quaerat voluptatibus tempore unde.,2014-05-22 03:35:04
26,392,3,Blanditiis alias laudantium tempora dolorem aliquam.,2018-03-04 11:42:50
517,393,2,Nesciunt officiis minima minima voluptate architecto at.,2021-03-30 12:10:22
477,394,1,Iste ab numquam voluptatem.,2015-05-13 14:19:29
154,395,4,Facilis assumenda suscipit reprehenderit eveniet aliquam.,2021-11-12 01:15:10
944,396,3,Tempore consectetur illo occaecati praesentium delectus natus fugiat.,2015-11-08 00:36:31
492,397,4,Beatae dolores eaque eveniet nam cum.,2018-03-22 22:44:16
334,398,5,Illo ea a aliquam eos voluptas.,2019-09-28 15:06:20
774,399,2,Distinctio exercitationem ipsa dolore expedita occaecati quidem.,2016-08-21 15:43:06
653,400,2,Expedita repudiandae voluptas exercitationem eaque odio.,2014-10-17 03:23:10
423,401,5,Ad impedit voluptate nam facere rem hic.,2024-05-13 13:43:11
236,402,4,Sapiente nemo unde quasi.,2024-06-25 07:06:29
829,403,2,Molestias porro reiciendis nisi.,2024-01-08 23:43:16
550,404,2,Quo ab incidunt quasi doloribus voluptatibus nisi.,2017-12-21 04:17:21
227,405,5,Porro dolorum recusandae quibusdam voluptates ea sunt.,2024-12-14 00:41:26
668,406,5,Architecto deleniti ea facere dignissimos pariatur aliquam illo.,2017-06-05 16:26:16
581,407,3,Delectus repellendus porro atque iusto sunt placeat.,2019-03-30 19:20:45
813,408,4,Magnam qui nihil.,2024-11-05 02:15:18
89,409,3,Assumenda voluptatibus voluptatum quas quia praesentium corrupti.,2017-06-25 01:30:57
854,410,4,Labore facilis vitae consequuntur ea delectus.,2020-08-24 09:08:21
556,411,1,Itaque atque iusto labore dolorem nam.,2022-08-13 00:49:28
449,412,5,Porro sequi placeat quod eligendi iste.,2017-07-18 04:30:30
69,413,4,Eligendi aut aut itaque.,2023-04-14 03:50:37
489,414,5,Rem ut ex laborum.,2019-02-06 15:44:20
26,415,4,Ea temporibus dolorum optio corporis.,2022-05-23 05:56:13
50,416,4,Perspiciatis necessitatibus alias sit maxime tempora.,2024-12-23 02:49:36
837,417,5,Distinctio quasi et eaque.,2024-03-27 15:34:52
562,418,1,Aperiam nam illo ut porro quaerat.,2019-02-04 07:41:20
690,419,5,Eveniet consectetur magnam occaecati architecto.,2022-11-23 01:32:09
552,420,5,Asperiores accusamus consequatur molestias.,2014-12-14 08:34:44
265,421,2,Eius suscipit dolorem maiores occaecati.,2015-04-06 15:04:15
207,422,5,Repellat nulla libero explicabo officia.,2016-09-04 16:01:31
928,423,5,In enim consectetur porro non ab laborum.,2023-08-28 13:15:54
560,424,3,Non ex cum ab amet occaecati dolorem.,2019-12-17 20:56:57
105,425,4,Nihil nam accusamus quod.,2014-01-03 13:16:57
771,426,5,Soluta ea veritatis perspiciatis illum culpa nemo.,2024-10-01 23:04:12
31,427,1,Aliquid illum fugiat odit nesciunt dolor cum.,2023-05-07 01:08:23
518,428,2,Deserunt minus corporis sint rem.,2017-03-09 15:59:52
137,429,3,Iure at alias suscipit eligendi voluptatibus enim.,2016-06-23 17:41:59
4,430,5,Accusamus atque voluptatem necessitatibus ad dicta vel.,2014-05-24 13:31:19
128,431,4,Dolores maxime voluptatibus exercitationem.,2022-07-17 17:16:22
382,432,5,Maiores dignissimos consectetur amet ullam.,2020-09-17 20:07:46
659,433,2,Sunt asperiores aliquid sed possimus nesciunt repellat.,2017-06-15 23:37:36
877,434,5,Aliquid ab illo aliquam vel dolorum quas.,2015-12-28 12:40:48
245,435,4,Consectetur cumque necessitatibus iure quia totam.,2020-10-03 17:20:14
943,436,4,Facilis ut consequatur blanditiis.,2019-11-06 18:22:43
349,437,3,Cumque consequatur impedit dignissimos libero molestiae beatae.,2019-08-31 10:34:02
211,438,2,Exercitationem nobis ipsa pariatur laboriosam ullam animi.,2019-06-02 03:22:05
190,439,5,Molestiae totam neque praesentium consectetur.,2023-08-31 10:41:34
60,440,1,Perspiciatis occaecati animi.,2017-10-21 07:31:18
916,441,4,Sapiente dolor dicta omnis officia culpa.,2019-06-13 09:36:13
443,442,4,Placeat et ullam dolorum.,2019-08-23 16:44:32
819,443,1,Sit qui debitis.,2023-10-06 15:00:09
1000,444,1,Ab hic alias harum quo.,2020-12-02 14:55:17
474,445,4,Cum minus ad rerum magnam.,2020-10-07 04:15:10
398,446,1,Voluptatum eveniet enim ipsa illo corrupti.,2017-11-17 00:22:16
811,447,2,Vero id cum pariatur est ab.,2024-07-08 03:20:37
888,448,5,Vitae neque veritatis incidunt suscipit adipisci iusto.,2014-03-19 08:10:32
832,449,3,Fugiat natus vitae quas mollitia accusamus.,2014-12-07 08:15:40
253,450,3,Dolor perspiciatis id aspernatur.,2021-04-08 12:55:42
901,451,1,Explicabo enim perferendis amet voluptas.,2018-12-07 07:00:47
615,452,2,Harum a commodi nam assumenda.,2019-05-27 18:00:07
575,453,5,Consequatur ab est neque.,2019-08-27 17:24:16
525,454,5,Et beatae nihil recusandae odit officiis.,2017-04-07 04:44:37
961,455,4,Maiores at delectus autem quasi sint voluptate natus.,2014-08-16 08:00:43
814,456,4,Temporibus dolore omnis quia.,2016-01-25 19:36:14
908,457,1,Cupiditate excepturi veniam harum et ex.,2021-07-12 12:17:09
741,458,5,Perferendis quasi impedit autem laborum.,2024-08-01 23:31:29
492,459,2,Sunt vel reprehenderit deserunt molestiae.,2019-11-18 02:32:54
638,460,1,Laborum enim repudiandae molestiae quod.,2016-10-12 06:38:59
753,461,3,Modi unde magnam mollitia a quos animi.,2024-02-08 06:50:53
974,462,3,Ullam porro voluptatum dolorem repellat recusandae repellendus nulla.,2021-12-11 14:13:00
829,463,3,Quas veniam earum quidem dolor excepturi accusamus.,2016-11-01 02:02:17
450,464,2,Distinctio ipsam quae.,2022-04-06 09:23:45
837,465,4,Quasi at repudiandae impedit distinctio similique incidunt tempore.,2018-02-08 01:03:34
216,466,1,Nobis recusandae nihil totam aperiam minus error.,2024-02-04 18:13:06
733,467,4,Quae repellendus perspiciatis dignissimos ut minima.,2017-03-19 13:41:40
162,468,1,Libero nesciunt nihil molestias.,2022-05-11 10:54:11
548,469,5,Nostrum nemo cum libero quisquam asperiores.,2018-02-07 20:13:21
280,470,3,Debitis dolorum expedita quibusdam excepturi dicta hic.,2019-06-16 13:13:37
814,471,4,Suscipit facere assumenda enim.,2017-11-30 03:28:36
551,472,2,Molestiae dolorem et blanditiis.,2016-07-03 08:37:26
994,473,3,Pariatur laboriosam nulla assumenda numquam.,2017-06-15 04:25:40
913,474,4,Fuga aliquam qui dignissimos doloremque.,2017-08-15 18:59:33
785,475,3,Quo cumque odio nisi enim alias.,2018-11-01 04:09:11
247,476,5,Eos praesentium officiis veniam neque voluptates id quod.,2020-01-12 12:57:43
768,477,3,Libero eligendi consequuntur blanditiis.,2014-03-14 08:45:12
645,478,2,Quae vitae ex alias cupiditate.,2016-07-07 07:11:32
611,479,3,Voluptas quos distinctio ad.,2022-06-19 08:51:45
656,480,5,Natus hic nulla accusantium.,2017-07-12 10:39:30
746,481,1,Sapiente eligendi accusantium quidem amet atque vitae expedita.,2018-04-14 07:50:10
612,482,3,Nisi nisi quidem magni.,2018-07-27 02:16:15
270,483,5,Ipsa iste rem cum eum animi harum officia.,2024-12-15 08:00:12
224,484,3,Dolore occaecati incidunt fugiat.,2024-09-13 10:02:16
816,485,4,Incidunt dolorum architecto veritatis quae maiores.,2022-05-24 07:34:27
534,486,4,Earum eligendi unde qui voluptatibus fuga incidunt.,2020-07-05 21:35:48
174,487,4,Temporibus amet incidunt facilis.,2024-10-29 01:44:16
29,488,3,Dolorem quis nesciunt sint dolor tempore commodi.,2018-04-17 23:23:48
634,489,5,Dolorem reprehenderit possimus corporis.,2023-08-04 14:22:42
845,490,3,Illum vitae itaque nemo eum iure natus.,2019-12-26 23:41:40
424,491,3,Doloremque aspernatur commodi deleniti amet placeat.,2018-08-04 07:12:24
776,492,1,Unde tempora optio quae dignissimos.,2016-11-20 01:32:23
133,493,5,Ratione quam ratione ipsa facere deleniti.,2024-03-08 17:17:46
190,494,5,Voluptatem voluptas temporibus hic maxime recusandae voluptas id.,2023-08-30 20:08:12
155,495,1,Veritatis iusto recusandae beatae.,2024-10-01 08:32:12
671,496,4,Aperiam repellendus tempore suscipit.,2014-10-07 00:00:01
131,497,2,Doloribus quis totam rem voluptates.,2015-12-30 01:36:18
517,498,4,Magnam assumenda delectus ducimus ipsum voluptatum exercitationem.,2020-12-10 08:31:44
134,499,4,Commodi iure mollitia culpa neque nesciunt consequuntur.,2022-02-06 11:04:34
781,500,4,Consequuntur sit enim blanditiis omnis quam.,2021-10-18 08:59:25
704,501,1,Quae assumenda illo repellendus voluptas cum est.,2014-10-09 15:54:19
481,502,2,Impedit blanditiis mollitia temporibus accusantium minus dolorum accusamus.,2017-08-07 15:31:14
865,503,4,Illo non reiciendis nostrum accusamus tenetur.,2019-04-21 13:29:14
440,504,1,Amet a totam rem.,2020-06-05 18:52:23
292,505,4,Voluptate facere et fugit.,2015-06-29 17:55:20
91,506,2,Saepe dicta voluptatum at non ab.,2023-12-04 07:21:50
161,507,5,Aspernatur consequatur doloremque quibusdam esse cum cum.,2021-02-01 23:37:34
741,508,4,Quibusdam sequi eius nobis delectus.,2015-12-07 17:53:02
497,509,3,Illo accusantium commodi mollitia.,2024-01-15 22:24:27
28,510,5,Aspernatur nulla quaerat.,2015-01-12 22:51:38
800,511,5,Cum blanditiis sint similique occaecati pariatur praesentium.,2016-10-10 02:01:49
589,512,3,Temporibus sed quam fugit accusamus fugit.,2017-10-20 23:20:56
564,513,1,Distinctio vero et commodi aperiam eaque.,2023-01-09 10:28:56
574,514,1,Incidunt delectus incidunt quidem.,2016-06-17 15:44:21
842,515,5,Facere animi nemo iusto dolor consequuntur.,2020-08-05 19:00:02
834,516,2,Reprehenderit nesciunt rerum.,2020-06-12 12:01:04
838,517,4,Qui corporis earum exercitationem tempora labore quo.,2023-10-07 04:04:36
816,518,5,Odit accusantium maxime optio quaerat.,2017-04-02 20:19:08
633,519,3,Expedita error sequi odit assumenda ut.,2024-04-15 04:54:56
93,520,1,Dolores commodi tempora corrupti consequuntur quod.,2018-10-15 12:11:42
834,521,4,Amet optio minima culpa autem rerum.,2018-01-19 20:08:20
402,522,1,Assumenda consectetur perspiciatis a occaecati laborum pariatur corrupti.,2022-09-18 06:21:50
298,523,4,Doloribus aspernatur odio numquam.,2015-04-20 09:14:02
608,524,5,Odio eligendi vitae natus expedita suscipit soluta.,2016-04-02 19:36:11
47,525,2,Amet culpa a incidunt molestias voluptate.,2024-12-16 15:27:37
225,526,3,A aspernatur tenetur commodi nisi nisi.,2022-02-15 23:14:19
515,527,3,Eligendi laboriosam rem aliquid necessitatibus.,2023-08-05 09:04:37
342,528,4,Aut quas voluptates placeat.,2021-08-22 10:08:04
186,529,3,Ratione cum eaque iste consequatur asperiores possimus.,2023-05-02 13:54:09
261,530,4,Corporis dolore a sequi hic necessitatibus.,2014-10-12 04:29:14
181,531,3,Possimus dolores tenetur ipsum.,2023-01-18 07:03:21
228,532,3,Amet deserunt doloribus id a.,2015-12-30 16:49:10
306,533,4,Pariatur magni veritatis aspernatur optio.,2016-08-16 09:24:07
580,534,4,Corporis incidunt facilis facere quaerat impedit quo.,2017-07-27 18:48:55
395,535,4,Accusantium error tenetur occaecati natus officia.,2017-02-19 23:17:12
838,536,4,Doloremque voluptate perspiciatis cumque possimus dolorum corporis.,2022-06-30 00:45:27
818,537,1,Dolore voluptate sapiente error architecto ipsum eius in.,2020-07-09 06:57:52
679,538,4,Voluptatum incidunt eum voluptas.,2021-09-12 07:17:08
512,539,3,Sit animi modi nobis quod.,2015-11-26 18:23:25
794,540,5,Ex incidunt molestias culpa eos.,2015-09-25 22:01:09
319,541,5,Voluptatibus totam aperiam id eos similique expedita optio.,2016-05-27 05:42:56
972,542,4,Asperiores harum nulla.,2023-09-19 05:36:04
605,543,5,Dolorum laborum exercitationem ea laboriosam officia nam.,2018-11-15 16:23:46
412,544,4,Mollitia rem incidunt fuga officiis ab.,2020-06-27 13:22:09
139,545,5,A doloremque maiores nemo.,2018-02-01 00:10:33
885,546,5,Veniam deleniti repellat fuga vero officia consectetur.,2019-01-09 21:05:54
883,547,3,Officiis omnis maxime consequuntur a.,2023-04-11 16:53:58
158,548,1,A vel ut sit corporis.,2015-03-17 02:15:51
660,549,5,Soluta vitae similique eaque suscipit consequuntur rem.,2021-06-03 15:19:03
641,550,1,Perspiciatis ad ipsam debitis exercitationem aut numquam.,2017-05-21 08:29:02
451,551,5,Et sint architecto.,2024-06-14 12:20:45
36,552,4,Hic eveniet vel voluptatum.,2019-12-29 11:27:04
864,553,4,Repellendus eveniet cupiditate itaque maiores excepturi sed.,2022-03-09 00:42:58
864,554,3,Neque recusandae vel et.,2015-09-30 20:21:06
91,555,5,Debitis temporibus delectus libero culpa excepturi.,2021-02-13 23:27:07
704,556,5,Officia ea dignissimos nesciunt sit.,2021-07-12 21:09:07
206,557,1,Numquam dolorem repellat optio.,2018-10-19 02:56:28
436,558,5,Et expedita totam.,2017-09-23 16:00:33
746,559,1,Accusantium quod impedit magnam debitis esse reprehenderit temporibus.,2024-09-30 21:40:27
135,560,2,Illo consequatur asperiores neque esse aspernatur.,2014-12-13 07:11:42
127,561,5,Ut beatae sequi quis possimus.,2015-08-24 00:28:27
809,562,1,Nulla placeat quod molestiae eos.,2015-03-03 20:10:45
111,563,2,Corrupti quidem est natus cumque.,2023-04-24 03:59:23
868,564,4,Odit ullam tempora assumenda placeat.,2021-08-28 13:19:41
970,565,4,Quis enim quas libero adipisci voluptatibus.,2022-09-19 22:17:11
7,566,1,Quas accusamus dolor reiciendis.,2021-09-18 15:16:05
747,567,3,Qui placeat magni perferendis eligendi voluptatem blanditiis dolores.,2019-03-01 03:07:16
600,568,1,Impedit iste aut sapiente dolore consequatur.,2024-04-30 19:21:19
518,569,2,Repellat vel voluptatibus fuga ipsum corrupti placeat.,2023-11-27 17:05:58
10,570,1,Soluta illum odit asperiores asperiores.,2020-05-27 12:31:11
372,571,1,Eum fugit assumenda eos natus saepe.,2021-03-09 08:34:15
992,572,5,Modi sunt placeat tempora odio earum fugiat architecto.,2024-10-13 15:51:17
103,573,3,Quas beatae accusantium.,2021-08-14 15:24:32
330,574,5,Odit quasi soluta eum distinctio.,2018-07-27 08:05:49
355,575,1,Expedita fuga ipsa laboriosam delectus.,2015-06-02 03:43:11
548,576,1,Rerum commodi neque similique dolorem sapiente.,2024-09-30 13:16:38
497,577,4,Deserunt incidunt atque earum quisquam inventore.,2017-06-12 11:03:43
292,578,5,Eligendi aliquam labore assumenda recusandae neque.,2024-10-16 17:34:31
238,579,1,Dignissimos perspiciatis optio ut optio.,2018-01-12 22:32:06
127,580,1,Fuga consequatur quod.,2020-12-06 02:11:47
209,581,2,Nulla in reiciendis aspernatur cupiditate illo minima aperiam.,2015-03-23 19:13:32
423,582,3,Quasi repudiandae deleniti alias.,2020-10-23 15:21:16
263,583,5,Veniam quibusdam non velit.,2017-07-25 07:17:17
838,584,2,Exercitationem ab exercitationem ab.,2019-12-16 03:29:50
571,585,1,Accusamus possimus expedita.,2014-08-09 06:11:41
760,586,5,Omnis repellendus quis molestias.,2017-05-10 06:10:31
968,587,5,Quia at minima dolorum ullam dolores aliquam.,2015-11-06 14:10:19
632,588,3,Amet placeat eaque veniam voluptatibus quasi.,2016-11-09 05:32:35
861,589,2,Officia odit fugit.,2019-11-11 10:48:21
37,590,3,Dicta quod aspernatur minus cum amet omnis.,2023-08-17 22:34:00
73,591,5,Ullam minima cum accusamus.,2021-01-29 00:30:17
482,592,4,Debitis saepe maiores illum atque.,2019-12-05 18:04:06
524,593,3,Ipsa optio iusto doloremque sunt dignissimos cupiditate voluptatem.,2022-06-29 08:38:18
261,594,3,Ab harum delectus enim exercitationem at labore.,2014-02-08 11:30:58
147,595,1,Dolorum excepturi atque a possimus dicta eveniet.,2019-11-20 11:44:22
460,596,2,Ut nulla perferendis eius.,2018-10-23 10:27:45
52,597,5,Nesciunt repellat cupiditate.,2024-01-01 21:23:55
298,598,4,Commodi est atque.,2017-08-30 07:55:28
594,599,1,Vitae accusamus quod sequi incidunt.,2024-03-20 21:40:13
86,600,4,Voluptatem pariatur fuga doloremque non non.,2014-02-03 03:52:07
958,601,3,Ex vero minus.,2022-04-09 18:09:47
992,602,3,Sunt dignissimos voluptatem.,2014-04-26 06:12:20
769,603,2,Numquam omnis illo ex voluptatum pariatur voluptatum temporibus.,2021-05-17 02:51:28
210,604,1,Vel eveniet eos consectetur harum perspiciatis.,2024-04-21 03:51:46
354,605,3,Aspernatur amet adipisci aut enim voluptates corporis.,2017-03-16 06:06:27
484,606,1,Ab provident fugit maxime consectetur.,2014-01-18 14:40:54
996,607,4,Necessitatibus nemo veniam deserunt.,2015-10-11 21:53:32
362,608,4,Labore voluptatibus maxime.,2016-06-18 11:10:48
208,609,1,Accusamus magni aperiam consequuntur ad.,2023-04-30 08:47:24
876,610,1,Velit libero voluptate fugit.,2019-06-26 01:58:21
160,611,2,Soluta numquam suscipit fugiat quisquam repellendus perspiciatis.,2022-05-23 15:27:01
640,612,3,Dolore omnis culpa delectus odit quo.,2021-03-04 19:23:46
669,613,3,Amet excepturi architecto.,2019-08-13 07:24:13
104,614,1,Pariatur eaque hic in ea suscipit sunt.,2014-08-04 03:15:04
366,615,1,Cumque tempora labore.,2020-07-05 13:44:26
479,616,2,Expedita minima eius quas quaerat dolor.,2018-08-17 16:02:56
501,617,2,Sequi nulla ad possimus perspiciatis.,2018-04-09 04:12:21
726,618,2,Error nemo ad sapiente sapiente quibusdam voluptatum.,2023-02-12 03:35:38
665,619,3,Nulla quaerat ut.,2020-11-02 02:05:26
684,620,1,Officiis rerum veniam.,2021-01-07 00:21:02
742,621,1,Aut culpa itaque aliquid.,2020-11-27 01:24:11
845,622,3,Sint exercitationem mollitia voluptatibus.,2024-08-20 10:09:52
673,623,4,Sit occaecati occaecati doloribus distinctio dicta fugit cupiditate.,2022-05-05 22:18:30
184,624,5,Aliquid totam itaque unde magni rerum iure quaerat.,2018-02-28 16:21:27
899,625,5,Itaque debitis consequatur ex quibusdam.,2024-01-11 03:41:01
453,626,3,Incidunt quae officia eos ad voluptate vel ipsam.,2024-07-29 18:27:18
550,627,2,Dicta quibusdam doloribus quod recusandae quisquam hic alias.,2018-10-17 21:33:35
529,628,2,Nemo esse repellendus vitae iure.,2021-08-21 06:14:42
526,629,1,Ratione corporis perspiciatis ex vel officia numquam.,2023-08-31 18:13:04
765,630,4,Placeat accusantium id quasi amet quasi.,2016-02-05 21:50:56
278,631,5,Officiis consectetur dolorum optio earum aperiam.,2018-06-10 20:21:22
404,632,5,Voluptas illo beatae iure rem.,2014-01-09 04:38:31
371,633,5,Suscipit rerum repellat ab.,2020-02-08 02:29:16
859,634,2,Voluptatum sunt tempore enim quos ipsam.,2016-01-11 08:15:20
587,635,4,Sint maxime reprehenderit porro fugit.,2019-04-29 23:40:24
244,636,5,Praesentium deserunt occaecati natus.,2014-06-18 18:14:15
901,637,2,Natus quas deserunt.,2015-07-11 19:14:10
202,638,4,Fuga expedita deserunt consectetur placeat libero beatae.,2022-03-15 18:07:10
246,639,1,Eius iste maxime deserunt aperiam dolores nesciunt tempore.,2015-08-19 08:00:36
400,640,4,Voluptatibus provident mollitia rerum.,2024-02-16 01:22:54
836,641,2,Quisquam fugit atque quas voluptas iure neque maxime.,2014-04-10 05:59:32
625,642,3,Suscipit adipisci ipsum sed eligendi.,2019-07-20 17:40:14
145,643,1,Iusto optio et eum.,2016-07-11 05:24:36
820,644,2,Earum iure recusandae dolor impedit consequuntur.,2023-09-06 21:23:43
788,645,5,Non occaecati perferendis recusandae repudiandae impedit iure.,2020-06-01 14:42:00
822,646,3,Eaque assumenda quibusdam occaecati amet.,2023-08-23 14:20:13
275,647,3,Ab corporis exercitationem architecto sapiente.,2015-06-08 10:32:22
805,648,3,Omnis natus expedita animi voluptatum explicabo deleniti ad.,2019-03-19 22:07:41
132,649,2,Optio molestiae veritatis rem alias.,2016-10-15 17:07:08
344,650,2,Velit at necessitatibus sint.,2016-05-04 05:43:55
383,651,4,Delectus quod accusamus iste quisquam debitis.,2020-08-02 02:51:28
93,652,5,Asperiores facere ad minus explicabo.,2020-04-20 18:20:32
128,653,1,Molestiae iste sit deleniti.,2016-02-04 04:51:06
230,654,5,Ratione ipsam laudantium quia facilis.,2023-08-03 06:33:23
707,655,5,Quam ipsam id dolorum ipsum.,2022-03-07 02:58:00
852,656,2,Quam voluptate ratione pariatur libero culpa.,2019-04-12 15:35:34
432,657,3,Recusandae explicabo a nobis quas aliquid.,2024-02-13 04:45:42
17,658,2,Optio quod aut repellat nisi facere.,2016-12-15 15:44:24
294,659,4,Architecto earum nam tempore error odio.,2016-02-20 19:01:23
724,660,4,Eaque repellat minima sequi.,2023-07-07 00:28:23
305,661,3,Odit nesciunt eius sapiente earum sint ad.,2023-11-24 22:58:27
616,662,2,Possimus repellat optio quas temporibus aperiam culpa.,2014-06-16 08:36:52
481,663,2,Labore quia deleniti ipsum natus aperiam rem.,2020-07-29 02:36:04
111,664,3,Molestias tempora neque.,2023-07-19 08:20:46
425,665,4,Quo dignissimos veniam natus amet maxime porro.,2020-01-01 02:43:59
630,666,4,Enim modi officia.,2024-02-19 00:05:50
620,667,2,Provident autem illum quod.,2015-11-02 04:06:50
776,668,4,Ipsam alias illum dignissimos minima ad inventore.,2020-03-18 19:03:04
268,669,2,Voluptatem delectus incidunt blanditiis dolorum dolores.,2015-09-29 09:03:49
951,670,4,Ut molestiae fuga quo minus.,2015-02-19 03:50:31
236,671,1,Nostrum optio quibusdam.,2020-10-29 03:57:13
156,672,3,Accusantium quasi id quidem expedita provident.,2021-01-23 04:52:13
950,673,2,Necessitatibus natus doloribus veniam.,2016-07-28 03:42:33
200,674,1,Dignissimos optio provident sit fuga.,2024-05-30 21:43:46
352,675,3,Soluta ad rerum esse molestiae error velit suscipit.,2015-07-14 17:52:44
79,676,2,Voluptatum voluptatibus rem repellendus saepe eos et.,2015-08-19 10:59:26
508,677,3,Odio beatae qui officia repudiandae cupiditate.,2022-10-18 01:37:00
886,678,4,Nesciunt earum omnis voluptatibus labore.,2021-07-26 07:01:13
700,679,3,Repellendus harum reprehenderit velit.,2020-11-03 21:10:54
300,680,2,Quo voluptates quidem sequi ratione veritatis odit harum.,2016-08-27 01:36:45
387,681,2,Sint quasi laboriosam laudantium rerum.,2015-05-21 03:48:15
729,682,5,Cumque dolore quis nemo quia.,2023-08-13 00:41:32
586,683,2,Ipsa tempora sint doloremque aperiam unde.,2022-05-19 02:29:10
855,684,5,Adipisci eum molestias quidem praesentium rem perferendis.,2024-10-16 00:08:52
82,685,2,Culpa voluptates suscipit qui eaque quos.,2023-09-25 06:16:11
805,686,3,Veniam dolore unde accusantium eligendi laboriosam.,2014-08-10 03:48:15
432,687,4,Illo voluptatem voluptates quibusdam quas.,2017-07-17 13:43:06
876,688,3,Culpa quo architecto doloribus repudiandae debitis cupiditate.,2023-12-21 07:35:30
384,689,2,Suscipit molestias libero deserunt fugiat.,2022-11-19 21:55:48
766,690,1,Consequuntur repellendus ullam soluta libero cum.,2021-02-14 18:22:06
385,691,2,Ea culpa tenetur corporis voluptates cupiditate.,2023-05-27 20:37:04
129,692,2,Exercitationem veniam soluta.,2022-09-29 02:57:12
242,693,5,Nobis laborum ipsa cumque voluptates nam.,2015-08-22 21:10:07
548,694,5,Dolores porro consequatur sequi impedit.,2016-11-02 20:59:14
440,695,2,Distinctio nesciunt maiores quis et adipisci.,2021-06-08 18:26:07
617,696,5,Iusto consectetur ut dolore maiores cupiditate.,2024-02-23 00:59:43
238,697,5,Debitis animi nesciunt modi earum deleniti.,2021-03-12 07:09:22
433,698,2,Eos accusamus tempore magnam eius.,2018-08-30 18:08:33
373,699,2,Beatae quo culpa amet ea minus illum temporibus.,2017-03-02 15:04:26
577,700,2,Veniam quidem totam fuga iusto molestias.,2021-03-12 18:37:52
876,701,1,Facilis dolore ipsum molestias possimus aliquam.,2017-09-25 00:33:47
143,702,5,Fuga culpa earum corrupti fuga delectus cupiditate hic.,2021-06-12 04:55:12
149,703,3,Sit non ullam repudiandae.,2014-10-18 22:58:31
947,704,3,Minima nihil quia laboriosam fugit.,2021-04-26 22:11:31
41,705,1,Quod quidem excepturi magnam.,2017-08-02 12:57:21
481,706,3,Vel natus unde maiores numquam.,2016-12-23 15:09:03
91,707,3,Distinctio dolor quae recusandae nemo porro sapiente.,2017-03-09 16:27:05
863,708,2,Eaque rem expedita blanditiis soluta.,2014-12-20 05:35:05
953,709,3,Quidem aperiam repudiandae similique.,2015-06-04 08:26:19
501,710,3,Minima asperiores sapiente nihil fuga rerum.,2024-02-04 02:43:40
767,711,1,Corrupti exercitationem similique.,2024-09-15 21:08:36
883,712,2,Neque facilis animi.,2022-08-13 05:28:51
220,713,3,Qui quae corrupti sequi dolorem expedita delectus.,2021-05-31 21:12:39
224,714,3,Quibusdam suscipit fugiat ipsa.,2016-10-19 10:08:22
834,715,2,Cumque neque error nemo placeat odit.,2023-08-18 04:17:03
399,716,2,Magni ipsam occaecati corporis dolorum sunt aut.,2014-09-28 08:43:23
767,717,1,Cumque iure maiores.,2019-05-16 06:33:37
255,718,1,Id facere repellendus ipsam.,2017-04-03 18:30:34
919,719,2,Velit porro omnis expedita iste neque quis.,2015-10-08 03:54:18
786,720,1,Ipsam sit officia laboriosam placeat adipisci eius.,2024-04-11 23:20:44
59,721,4,Pariatur nam vitae totam.,2020-01-30 09:53:45
676,722,3,Molestiae sunt temporibus non.,2016-03-15 15:04:03
